{
  "$schema": "../../../../../docs/packs/schema/course-unit.schema.json",
  "id": "u28",
  "title": "Music and dance",
  "description": "Taarab, bongo flava and the drum, and the words for the people who make music.",
  "color": "vermillion",
  "character": "neema",
  "words": [
    { "id": "mwimbaji", "target": "mwimbaji", "base": "singer", "altBase": ["the singer"], "notes": "From -imba (sing). Many: waimbaji." },
    {
      "id": "mchezaji",
      "target": "mchezaji",
      "base": "player",
      "altBase": ["dancer", "the player"],
      "notes": "From -cheza. Many: wachezaji."
    },
    { "id": "mpiga-ngoma", "target": "mpiga ngoma", "base": "drummer", "altBase": ["the drummer"] },
    { "id": "bendi", "target": "bendi", "base": "band", "altBase": ["the band"] },
    {
      "id": "taarab",
      "target": "taarab",
      "base": "taarab",
      "altBase": ["taarab music"],
      "notes": "Sung poetry with strings and drums, born in Zanzibar."
    },
    { "id": "gitaa", "target": "gitaa", "base": "guitar", "altBase": ["the guitar"] },
    { "id": "sauti", "target": "sauti", "base": "voice", "altBase": ["sound", "noise", "the voice"] },
    { "id": "tamasha", "target": "tamasha", "base": "concert", "altBase": ["show", "festival", "the concert"] },
    {
      "id": "kupiga",
      "target": "kupiga",
      "base": "to play (an instrument)",
      "altBase": ["play", "to hit", "to beat"],
      "notes": "Kupiga gitaa, kupiga ngoma. Also “to hit”."
    },
    { "id": "kusikiliza", "target": "kusikiliza", "base": "to listen", "altBase": ["listening", "listen"] }
  ],
  "sentences": [
    {
      "id": "s-mwimbaji",
      "target": "Mwimbaji ana sauti nzuri.",
      "base": "The singer has a beautiful voice.",
      "altBase": ["The singer has a nice voice.", "The singer has a good voice."]
    },
    {
      "id": "s-mchezaji",
      "target": "Neema ni mchezaji hodari.",
      "base": "Neema is a skilful dancer.",
      "altBase": ["Neema is a good dancer.", "Neema is a great dancer."]
    },
    { "id": "s-mpiga-ngoma", "target": "Mpiga ngoma ni babu yangu.", "base": "The drummer is my grandfather." },
    {
      "id": "s-bendi",
      "target": "Bendi itapiga muziki usiku.",
      "base": "The band will play music tonight.",
      "altBase": ["The band will play at night."]
    },
    { "id": "s-taarab", "target": "Bibi anapenda taarab.", "base": "Grandma loves taarab.", "altBase": ["Grandma likes taarab."] },
    {
      "id": "s-kupiga-gitaa",
      "target": "Ninajifunza kupiga gitaa.",
      "base": "I’m learning to play the guitar.",
      "altBase": ["I am learning to play guitar."]
    },
    {
      "id": "s-tamasha",
      "target": "Kuna tamasha Jumamosi.",
      "base": "There’s a concert on Saturday.",
      "altBase": ["There is a concert on Saturday."]
    },
    {
      "id": "s-kusikiliza",
      "target": "Ninapenda kusikiliza muziki.",
      "base": "I like listening to music.",
      "altBase": ["I like to listen to music.", "I love listening to music."]
    },
    { "id": "s-sauti", "target": "Sauti ni kubwa sana!", "base": "The sound is very loud!", "altBase": ["It’s very loud!"] }
  ],
  "skills": [
    {
      "id": "u28s1",
      "title": "Who makes music",
      "icon": "music",
      "tip": "doer-nouns",
      "lessons": [
        {
          "id": "u28s1l1",
          "newWords": ["mwimbaji", "mchezaji", "mpiga-ngoma", "sauti"],
          "sentences": ["s-mwimbaji", "s-mchezaji", "s-mpiga-ngoma", "s-sauti"]
        },
        { "id": "u28s1l2", "newWords": ["bendi", "taarab"], "sentences": ["s-bendi", "s-taarab", "s-mwimbaji"] }
      ]
    },
    {
      "id": "u28s2",
      "title": "Playing and listening",
      "icon": "speaker",
      "lessons": [
        {
          "id": "u28s2l1",
          "newWords": ["kupiga", "gitaa", "kusikiliza", "tamasha"],
          "sentences": ["s-kupiga-gitaa", "s-kusikiliza", "s-tamasha"],
          "dialogues": [
            {
              "speaker": "juma",
              "target": "Unapenda muziki gani?",
              "base": "What music do you like?",
              "options": ["Ninapenda kusikiliza bongo flava.", "Mpiga ngoma ni babu.", "Kuna jirani."],
              "answer": "Ninapenda kusikiliza bongo flava."
            }
          ]
        }
      ]
    }
  ],
  "guidebook": {
    "intro": "From the strings of Zanzibar’s taarab to Dar es Salaam’s bongo flava, music is everywhere. Learn the words, and how Swahili makes “doer” nouns.",
    "phrases": [
      { "target": "Ninapenda kusikiliza muziki.", "base": "I like listening to music." },
      { "target": "Mwimbaji ana sauti nzuri.", "base": "The singer has a beautiful voice." },
      { "target": "Ninajifunza kupiga gitaa.", "base": "I’m learning to play the guitar." },
      { "target": "Kuna tamasha Jumamosi.", "base": "There’s a concert on Saturday." }
    ],
    "tips": [
      {
        "id": "doer-nouns",
        "title": "The one who does it",
        "body": [
          "Swahili makes “the one who does” from a verb with **m-** in front and often **-ji** at the end: **-imba** (sing) → **mwimbaji** (singer), **-cheza** → **mchezaji** (player, dancer), **-pika** → **mpishi** (cook).",
          "For many, use **wa-**: **waimbaji**, **wachezaji**. Another pattern is **m-** + verb + object: **mpiga ngoma** (drummer, “one who beats the drum”)."
        ]
      }
    ],
    "culture": [
      {
        "title": "Taarab",
        "body": [
          "**Taarab** grew in Zanzibar’s sultan’s court in the 1800s. Its sung poetry is full of double meanings, and Bi Kidude, who sang until she was over 100, is its best-loved voice."
        ]
      }
    ]
  },
  "stories": [
    {
      "id": "sw-concert-night",
      "title": "Concert night",
      "unlockAfter": "u28s2l1",
      "cast": ["neema", "juma"],
      "summary": "Neema and Juma go to a concert in Nairobi.",
      "steps": [
        {
          "line": {
            "speaker": "juma",
            "target": "Neema, umesikia? Kuna tamasha kubwa leo usiku.",
            "base": "Neema, have you heard? There’s a big concert tonight."
          },
          "gloss": { "umesikia": "have you heard" }
        },
        {
          "line": { "speaker": "neema", "target": "Ndiyo! Mwimbaji ninayempenda zaidi ataimba.", "base": "Yes! My favourite singer will sing." },
          "gloss": { "ninayempenda zaidi": "whom I love most" }
        },
        { "question": "Who will sing?", "options": ["Neema’s favourite singer", "Juma", "Bibi"], "answer": 0 },
        {
          "line": { "speaker": "juma", "target": "Na bendi itapiga muziki wa taarab pia.", "base": "And the band will play taarab music too." }
        },
        { "line": { "speaker": "neema", "target": "Twende tukacheze!", "base": "Let’s go dancing!" } },
        { "question": "What will the band also play?", "options": ["Taarab", "Rock", "Nothing"], "answer": 0 },
        {
          "line": { "speaker": "juma", "target": "Sauti ni kubwa sana… lakini ni safi kabisa!", "base": "It’s so loud… but it’s totally great!" }
        },
        { "question": "How does Neema say “singer”?", "options": ["mwimbaji", "mchezaji", "bendi"], "answer": 0, "optionsLang": "target" }
      ]
    }
  ]
}