{
  "$schema": "../../../../../docs/packs/schema/course-unit.schema.json",
  "id": "u39",
  "title": "Respect and etiquette",
  "description": "Visit someone’s home, ask politely and show respect the Swahili way.",
  "color": "butter",
  "character": "bibi",
  "words": [
    { "id": "heshima", "target": "heshima", "base": "respect", "altBase": ["honour", "dignity"] },
    { "id": "adabu", "target": "adabu", "base": "manners", "altBase": ["good manners", "politeness"] },
    {
      "id": "hodi",
      "target": "Hodi!",
      "base": "May I come in?",
      "altBase": ["anyone home?", "hello, anyone in?"],
      "notes": "Called at the door. The answer is Karibu!"
    },
    { "id": "naomba", "target": "naomba", "base": "may I have", "altBase": ["i ask for", "please may i have", "i request"] },
    { "id": "hamna-shida", "target": "Hamna shida", "base": "No problem", "altBase": ["no worries", "it’s no problem"] },
    {
      "id": "pole-kwa-kazi",
      "target": "Pole kwa kazi",
      "base": "Well done for your hard work",
      "altBase": ["sorry for the work", "thank you for your work", "good work"]
    },
    { "id": "mkono-wa-kulia", "target": "mkono wa kulia", "base": "right hand", "altBase": ["the right hand"] },
    { "id": "ukarimu", "target": "ukarimu", "base": "hospitality", "altBase": ["generosity", "kindness"] },
    { "id": "karibu-tena", "target": "Karibu tena", "base": "Come again", "altBase": ["welcome again", "you are welcome again"] }
  ],
  "sentences": [
    { "id": "s-heshima", "target": "Heshima ni muhimu sana.", "base": "Respect is very important." },
    {
      "id": "s-adabu",
      "target": "Mtoto huyu ana adabu.",
      "base": "This child has good manners.",
      "altBase": ["This child is well-mannered.", "This child has manners."]
    },
    {
      "id": "s-hodi",
      "target": "Hodi! Karibu!",
      "base": "May I come in? Come in!",
      "altBase": ["Anyone home? Welcome!", "May I come in? Welcome!"]
    },
    {
      "id": "s-naomba",
      "target": "Naomba maji, tafadhali.",
      "base": "May I have some water, please.",
      "altBase": ["May I have water, please?", "Could I have some water, please?"]
    },
    {
      "id": "s-hamna-shida",
      "target": "Hamna shida, rafiki yangu.",
      "base": "No problem, my friend.",
      "altBase": ["No worries, my friend."]
    },
    {
      "id": "s-pole-kwa-kazi",
      "target": "Pole kwa kazi, mama!",
      "base": "Well done for your hard work, mama!",
      "altBase": ["Thank you for your work, mama!", "Good work, mama!"]
    },
    {
      "id": "s-mkono-kulia",
      "target": "Kula kwa mkono wa kulia.",
      "base": "Eat with the right hand.",
      "altBase": ["Eat with your right hand."]
    },
    {
      "id": "s-ukarimu",
      "target": "Asante kwa ukarimu wako.",
      "base": "Thank you for your hospitality.",
      "altBase": ["Thanks for your hospitality."]
    },
    {
      "id": "s-karibu-tena",
      "target": "Asante, karibu tena!",
      "base": "Thank you, come again!",
      "altBase": ["Thanks, come again!", "Thank you, welcome again!"]
    }
  ],
  "skills": [
    {
      "id": "u39s1",
      "title": "Greeting elders",
      "icon": "profile",
      "tip": "respect",
      "lessons": [
        {
          "id": "u39s1l1",
          "newWords": ["heshima", "adabu", "hodi"],
          "sentences": ["s-heshima", "s-adabu", "s-hodi"],
          "dialogues": [
            {
              "speaker": "bibi",
              "target": "Hodi!",
              "base": "May I come in?",
              "options": ["Karibu!", "Kwaheri!", "Mwizi!"],
              "answer": "Karibu!"
            }
          ]
        }
      ]
    },
    {
      "id": "u39s2",
      "title": "Polite words",
      "icon": "star",
      "lessons": [
        {
          "id": "u39s2l1",
          "newWords": ["naomba", "hamna-shida", "pole-kwa-kazi"],
          "sentences": ["s-naomba", "s-hamna-shida", "s-pole-kwa-kazi"]
        }
      ]
    },
    {
      "id": "u39s3",
      "title": "Being a guest",
      "icon": "home",
      "lessons": [
        {
          "id": "u39s3l1",
          "newWords": ["mkono-wa-kulia", "ukarimu", "karibu-tena"],
          "sentences": ["s-mkono-kulia", "s-ukarimu", "s-karibu-tena"],
          "dialogues": [
            {
              "speaker": "bibi",
              "target": "Karibu chakula!",
              "base": "Come and eat!",
              "options": ["Asante sana, bibi.", "Hodi!", "Sikubaliani."],
              "answer": "Asante sana, bibi."
            }
          ]
        }
      ]
    }
  ],
  "guidebook": {
    "intro": "Good manners open every door on the coast and inland. A few words and gestures show people you respect them.",
    "phrases": [
      { "target": "Hodi! Karibu!", "base": "May I come in? Come in!" },
      { "target": "Naomba maji, tafadhali.", "base": "May I have some water, please." },
      { "target": "Pole kwa kazi!", "base": "Well done for your hard work!" },
      { "target": "Asante kwa ukarimu wako.", "base": "Thank you for your hospitality." }
    ],
    "tips": [
      {
        "id": "respect",
        "title": "Asking politely",
        "body": [
          "**Naomba** (I ask for) is much softer than **Nataka** (I want). Use it in shops, at a friend’s home and with anyone older: **Naomba chai**.",
          "At a door, call **Hodi!** and wait for **Karibu!** before you go in. Greet elders first with **Shikamoo**, and wait for **Marahaba**."
        ]
      }
    ],
    "culture": [
      {
        "title": "The right hand",
        "body": [
          "Give, receive and eat with the **right hand**, or with both hands to show extra respect. Using only the left hand can seem rude.",
          "**Pole kwa kazi** is said to anyone working, from a cook to a builder: it recognises their effort."
        ]
      }
    ]
  },
  "stories": [
    {
      "id": "sw-visiting-bibi",
      "title": "Visiting Bibi",
      "unlockAfter": "u39s3l1",
      "cast": ["emma", "bibi"],
      "summary": "Emma visits Bibi’s home and remembers her manners.",
      "steps": [
        { "line": { "speaker": "emma", "target": "Hodi!", "base": "May I come in?" } },
        {
          "line": { "speaker": "bibi", "target": "Karibu, mwanangu! Ingia.", "base": "Come in, my child! Enter." },
          "gloss": { "mwanangu": "my child", "Ingia": "come in, enter" }
        },
        { "line": { "speaker": "emma", "target": "Shikamoo, bibi.", "base": "My respects, Grandma." } },
        { "line": { "speaker": "bibi", "target": "Marahaba. Unataka chai?", "base": "Thank you. Do you want tea?" } },
        { "question": "How does Emma greet Bibi?", "options": ["Shikamoo", "Mambo", "Poa"], "answer": 0 },
        {
          "line": {
            "speaker": "emma",
            "target": "Asante. Naomba maji kwanza, tafadhali.",
            "base": "Thank you. May I have some water first, please."
          }
        },
        {
          "line": {
            "speaker": "bibi",
            "target": "Hamna shida. Haya, kula kwa mkono wa kulia!",
            "base": "No problem. Now, eat with your right hand!"
          },
          "gloss": { "Haya": "all right, now" }
        },
        { "question": "Which hand should Emma eat with?", "options": ["The right hand", "The left hand", "Either hand"], "answer": 0 },
        { "line": { "speaker": "emma", "target": "Asante kwa ukarimu wako, bibi.", "base": "Thank you for your hospitality, Grandma." } },
        { "line": { "speaker": "bibi", "target": "Karibu tena!", "base": "Come again!" } },
        {
          "question": "How does Emma ask politely for water?",
          "options": ["Naomba maji", "Nataka maji", "Nipe maji"],
          "answer": 0,
          "optionsLang": "target"
        }
      ]
    }
  ]
}
