{
  "$schema": "../../../../../docs/packs/schema/course-unit.schema.json",
  "id": "u39",
  "title": "Heshima na adabu",
  "description": "Tembelea nyumba ya mtu, omba kwa adabu na onyesha heshima kwa Kiingereza.",
  "color": "butter",
  "character": "bibi",
  "words": [
    { "id": "heshima", "target": "respect", "base": "heshima", "altTarget": ["honour", "dignity"] },
    { "id": "adabu", "target": "manners", "base": "adabu", "altTarget": ["good manners", "politeness"] },
    { "id": "hodi", "target": "May I come in?", "base": "Hodi!", "altTarget": ["anyone home?", "hello, anyone in?"] },
    { "id": "naomba", "target": "may I have", "base": "naomba", "altTarget": ["i ask for", "please may i have", "i request"] },
    { "id": "hamna-shida", "target": "No problem", "base": "Hamna shida", "altTarget": ["no worries", "it’s no problem"] },
    {
      "id": "pole-kwa-kazi",
      "target": "Well done for your hard work",
      "base": "Pole kwa kazi",
      "altTarget": ["sorry for the work", "thank you for your work", "good work"]
    },
    { "id": "mkono-wa-kulia", "target": "right hand", "base": "mkono wa kulia", "altTarget": ["the right hand"] },
    { "id": "ukarimu", "target": "hospitality", "base": "ukarimu", "altTarget": ["generosity", "kindness"] },
    { "id": "karibu-tena", "target": "Come again", "base": "Karibu tena", "altTarget": ["welcome again", "you are welcome again"] }
  ],
  "sentences": [
    { "id": "s-heshima", "target": "Respect is very important.", "base": "Heshima ni muhimu sana." },
    {
      "id": "s-adabu",
      "target": "This child has good manners.",
      "base": "Mtoto huyu ana adabu.",
      "altTarget": ["This child is well-mannered.", "This child has manners."]
    },
    {
      "id": "s-hodi",
      "target": "May I come in? Come in!",
      "base": "Hodi! Karibu!",
      "altTarget": ["Anyone home? Welcome!", "May I come in? Welcome!"]
    },
    {
      "id": "s-naomba",
      "target": "May I have some water, please.",
      "base": "Naomba maji, tafadhali.",
      "altTarget": ["May I have water, please?", "Could I have some water, please?"]
    },
    {
      "id": "s-hamna-shida",
      "target": "No problem, my friend.",
      "base": "Hamna shida, rafiki yangu.",
      "altTarget": ["No worries, my friend."]
    },
    {
      "id": "s-pole-kwa-kazi",
      "target": "Well done for your hard work, mama!",
      "base": "Pole kwa kazi, mama!",
      "altTarget": ["Thank you for your work, mama!", "Good work, mama!"]
    },
    {
      "id": "s-mkono-kulia",
      "target": "Eat with the right hand.",
      "base": "Kula kwa mkono wa kulia.",
      "altTarget": ["Eat with your right hand."]
    },
    {
      "id": "s-ukarimu",
      "target": "Thank you for your hospitality.",
      "base": "Asante kwa ukarimu wako.",
      "altTarget": ["Thanks for your hospitality."]
    },
    {
      "id": "s-karibu-tena",
      "target": "Thank you, come again!",
      "base": "Asante, karibu tena!",
      "altTarget": ["Thanks, come again!", "Thank you, welcome again!"]
    }
  ],
  "skills": [
    {
      "id": "u39s1",
      "title": "Kuwasalimia wazee",
      "icon": "profile",
      "tip": "may-could",
      "lessons": [
        {
          "id": "u39s1l1",
          "newWords": ["heshima", "adabu", "hodi"],
          "sentences": ["s-heshima", "s-adabu", "s-hodi"],
          "dialogues": [
            {
              "speaker": "bibi",
              "target": "May I come in?",
              "base": "Hodi!",
              "options": ["Come in!", "Goodbye!", "Thief!"],
              "answer": "Come in!"
            }
          ]
        }
      ]
    },
    {
      "id": "u39s2",
      "title": "Maneno ya adabu",
      "icon": "star",
      "tip": "thank-you-for",
      "lessons": [
        {
          "id": "u39s2l1",
          "newWords": ["naomba", "hamna-shida", "pole-kwa-kazi"],
          "sentences": ["s-naomba", "s-hamna-shida", "s-pole-kwa-kazi"]
        }
      ]
    },
    {
      "id": "u39s3",
      "title": "Kuwa mgeni",
      "icon": "home",
      "lessons": [
        {
          "id": "u39s3l1",
          "newWords": ["mkono-wa-kulia", "ukarimu", "karibu-tena"],
          "sentences": ["s-mkono-kulia", "s-ukarimu", "s-karibu-tena"],
          "dialogues": [
            {
              "speaker": "bibi",
              "target": "Come and eat!",
              "base": "Karibu chakula!",
              "options": ["Thank you very much, Grandma.", "May I come in?", "I don’t agree."],
              "answer": "Thank you very much, Grandma."
            }
          ]
        }
      ]
    }
  ],
  "guidebook": {
    "intro": "Adabu hufungua kila mlango. Maneno machache ya Kiingereza yanaonyesha unawaheshimu watu.",
    "phrases": [
      { "target": "May I come in? Come in!", "base": "Hodi! Karibu!" },
      { "target": "May I have some water, please.", "base": "Naomba maji, tafadhali." },
      { "target": "Well done for your hard work!", "base": "Pole kwa kazi!" },
      { "target": "Thank you for your hospitality.", "base": "Asante kwa ukarimu wako." }
    ],
    "tips": [
      {
        "id": "may-could",
        "title": "May I…? Could I…?",
        "body": [
          "**Naomba** ni laini kuliko **nataka**; Kiingereza husema **May I have…?** au **Could I have…, please?**: **May I have some water, please?**",
          "Mlangoni: **May I come in?** (Hodi!) na jibu ni **Come in!** (Karibu!)."
        ]
      },
      {
        "id": "thank-you-for",
        "title": "Thank you for…",
        "body": [
          "Kushukuru kwa kitu, tumia **for**: **Thank you for your hospitality**, **Thank you for the food**. Na kitenzi, **-ing**: **Thank you for coming.**",
          "**Pole kwa kazi** haina tafsiri moja; sema **Thanks for your hard work** au **Good job!** **Hamna shida** ni **No problem** au **You’re welcome**."
        ]
      }
    ],
    "culture": [
      {
        "title": "Please na thank you",
        "body": [
          "Kiingereza hutumia **please** na **thank you** mara nyingi sana, hata kwa watu wa familia na dukani. Kuacha **please** kunaweza kusikika kama amri."
        ]
      }
    ]
  },
  "stories": [
    {
      "id": "sw-visiting-bibi",
      "title": "Kumtembelea Bibi",
      "unlockAfter": "u39s3l1",
      "cast": ["emma", "bibi"],
      "summary": "Emma anamtembelea Bibi nyumbani na anakumbuka adabu zake.",
      "steps": [
        { "line": { "speaker": "emma", "target": "May I come in?", "base": "Hodi!" } },
        { "line": { "speaker": "bibi", "target": "Come in, my child! Enter.", "base": "Karibu, mwanangu! Ingia." } },
        { "line": { "speaker": "emma", "target": "My respects, Grandma.", "base": "Shikamoo, bibi." } },
        { "line": { "speaker": "bibi", "target": "Thank you. Do you want tea?", "base": "Marahaba. Unataka chai?" } },
        { "question": "Emma anamsalimiaje Bibi?", "options": ["Shikamoo", "Mambo", "Poa"], "answer": 0 },
        {
          "line": {
            "speaker": "emma",
            "target": "Thank you. May I have some water first, please?",
            "base": "Asante. Naomba maji kwanza, tafadhali."
          }
        },
        {
          "line": {
            "speaker": "bibi",
            "target": "No problem. Now, eat with your right hand!",
            "base": "Hamna shida. Haya, kula kwa mkono wa kulia!"
          }
        },
        { "question": "Emma anapaswa kula kwa mkono gani?", "options": ["Mkono wa kulia", "Mkono wa kushoto", "Mkono wowote"], "answer": 0 },
        { "line": { "speaker": "emma", "target": "Thank you for your hospitality, Grandma.", "base": "Asante kwa ukarimu wako, bibi." } },
        { "line": { "speaker": "bibi", "target": "Come again!", "base": "Karibu tena!" } },
        {
          "question": "Emma anaombaje maji kwa adabu?",
          "options": ["May I have some water, please?", "I want water.", "Give me water."],
          "answer": 0,
          "optionsLang": "target"
        }
      ]
    }
  ]
}
