{
  "$schema": "../../../../../docs/packs/schema/course-unit.schema.json",
  "id": "u38",
  "title": "Emergencies",
  "description": "Call for help, explain what happened and calm someone down.",
  "color": "vermillion",
  "character": "juma",
  "words": [
    { "id": "ajali", "target": "ajali", "base": "accident", "altBase": ["the accident", "crash"] },
    { "id": "polisi", "target": "polisi", "base": "police", "altBase": ["the police", "police officer"] },
    {
      "id": "gari-la-wagonjwa",
      "target": "gari la wagonjwa",
      "base": "ambulance",
      "altBase": ["an ambulance", "the ambulance"],
      "notes": "Literally “car of the sick”."
    },
    { "id": "kumetokea", "target": "kumetokea", "base": "there has been", "altBase": ["it has happened", "something happened"] },
    { "id": "damu", "target": "damu", "base": "blood" },
    {
      "id": "ameumia",
      "target": "ameumia",
      "base": "he is hurt",
      "altBase": ["she is hurt", "he has been hurt", "she has been hurt", "is injured"]
    },
    { "id": "mwizi", "target": "mwizi", "base": "thief", "altBase": ["the thief", "robber"], "notes": "Plural: wezi." },
    { "id": "ameibiwa", "target": "ameibiwa", "base": "he has been robbed", "altBase": ["she has been robbed", "has had something stolen"] },
    { "id": "salama", "target": "salama", "base": "safe", "altBase": ["safely", "peace"] },
    { "id": "tulia", "target": "Tulia", "base": "Calm down", "altBase": ["be calm", "stay calm"] },
    { "id": "usiogope", "target": "Usiogope", "base": "Don’t be afraid", "altBase": ["do not be afraid", "don’t worry"] }
  ],
  "sentences": [
    {
      "id": "s-ajali",
      "target": "Kumetokea ajali barabarani!",
      "base": "There has been an accident on the road!",
      "altBase": ["There’s been an accident on the road!"]
    },
    { "id": "s-polisi", "target": "Piga simu polisi!", "base": "Call the police!" },
    {
      "id": "s-gari-wagonjwa",
      "target": "Tunataka gari la wagonjwa haraka!",
      "base": "We need an ambulance quickly!",
      "altBase": ["We want an ambulance quickly!", "We need an ambulance fast!"]
    },
    {
      "id": "s-damu",
      "target": "Anatoka damu nyingi.",
      "base": "He is bleeding a lot.",
      "altBase": ["She is bleeding a lot.", "He’s bleeding a lot.", "She’s bleeding a lot."]
    },
    {
      "id": "s-ameumia",
      "target": "Mtoto ameumia mguu.",
      "base": "The child has hurt a leg.",
      "altBase": ["The child has hurt his leg.", "The child has hurt her leg.", "The child hurt a leg."]
    },
    { "id": "s-mwizi", "target": "Mwizi! Mwizi!", "base": "Thief! Thief!", "altBase": ["Stop, thief!"] },
    {
      "id": "s-ameibiwa",
      "target": "Ameibiwa simu yake.",
      "base": "His phone has been stolen.",
      "altBase": ["Her phone has been stolen.", "He has been robbed of his phone.", "She has been robbed of her phone."]
    },
    { "id": "s-salama", "target": "Sasa uko salama.", "base": "Now you are safe.", "altBase": ["You are safe now.", "You’re safe now."] },
    { "id": "s-tulia", "target": "Tulia, msaada unakuja.", "base": "Calm down, help is coming.", "altBase": ["Stay calm, help is coming."] },
    {
      "id": "s-usiogope",
      "target": "Usiogope, niko hapa.",
      "base": "Don’t be afraid, I’m here.",
      "altBase": ["Do not be afraid, I am here."]
    }
  ],
  "skills": [
    {
      "id": "u38s1",
      "title": "Help!",
      "icon": "bolt",
      "lessons": [
        { "id": "u38s1l1", "newWords": ["ajali", "kumetokea", "polisi"], "sentences": ["s-ajali", "s-polisi", "s-mwizi"] },
        {
          "id": "u38s1l2",
          "newWords": ["gari-la-wagonjwa", "mwizi"],
          "sentences": ["s-gari-wagonjwa", "s-mwizi", "s-ajali"],
          "dialogues": [
            {
              "speaker": "juma",
              "target": "Kumetokea nini?",
              "base": "What has happened?",
              "options": ["Kumetokea ajali!", "Nakubali.", "Paukwa!"],
              "answer": "Kumetokea ajali!"
            }
          ]
        }
      ]
    },
    {
      "id": "u38s2",
      "title": "Accidents",
      "icon": "heart",
      "tip": "ku-there",
      "lessons": [{ "id": "u38s2l1", "newWords": ["damu", "ameumia", "ameibiwa"], "sentences": ["s-damu", "s-ameumia", "s-ameibiwa"] }]
    },
    {
      "id": "u38s3",
      "title": "After the danger",
      "icon": "check",
      "tip": "usi-dont",
      "lessons": [
        {
          "id": "u38s3l1",
          "newWords": ["salama", "tulia", "usiogope"],
          "sentences": ["s-salama", "s-tulia", "s-usiogope"],
          "dialogues": [
            {
              "speaker": "emma",
              "target": "Naogopa sana!",
              "base": "I’m very scared!",
              "options": ["Usiogope, uko salama.", "Mwizi!", "Piga kura."],
              "answer": "Usiogope, uko salama."
            }
          ]
        }
      ]
    }
  ],
  "guidebook": {
    "intro": "You hope never to need these words, but knowing them makes you calmer when something goes wrong.",
    "phrases": [
      { "target": "Kumetokea ajali!", "base": "There has been an accident!" },
      { "target": "Piga simu polisi!", "base": "Call the police!" },
      { "target": "Tunataka gari la wagonjwa!", "base": "We need an ambulance!" },
      { "target": "Usiogope, uko salama.", "base": "Don’t be afraid, you’re safe." }
    ],
    "tips": [
      {
        "id": "ku-there",
        "title": "Something happened: ku-",
        "body": [
          "For events with no clear subject, Swahili uses the place prefix **ku-**: **kumetokea ajali** (there has been an accident), **kuna moto** (there is a fire).",
          "Changes that happen to someone often take **-wa** (the passive) or a stative ending: **ameibiwa** (has been robbed), **ameumia** (is hurt)."
        ]
      },
      {
        "id": "usi-dont",
        "title": "Don’t: usi- … -e",
        "body": [
          "To tell someone not to do something, use **usi-** and change the last **-a** to **-e**: **ogopa** (fear) → **usiogope** (don’t be afraid), **kimbia** (run) → **usikimbie** (don’t run).",
          "You already know **Usijali** (don’t worry). Talking to several people, use **msi-**: **msiogope**."
        ]
      }
    ],
    "culture": [
      {
        "title": "Neighbours first",
        "body": [
          "In an emergency the first help usually comes from the people around you: neighbours, shopkeepers and boda boda riders who carry the injured to hospital. Emergency numbers differ from country to country, so save the local ones when you arrive."
        ]
      }
    ]
  },
  "stories": [
    {
      "id": "sw-the-accident",
      "title": "The accident",
      "unlockAfter": "u38s3l1",
      "cast": ["juma", "emma"],
      "summary": "Juma and Emma see a boda boda fall and help the rider.",
      "steps": [
        { "line": { "speaker": "emma", "target": "Juma! Kumetokea ajali!", "base": "Juma! There’s been an accident!" } },
        {
          "line": {
            "speaker": "juma",
            "target": "Boda boda imeanguka. Dereva ameumia mguu.",
            "base": "A boda boda has fallen. The rider has hurt his leg."
          },
          "gloss": { "imeanguka": "it has fallen" }
        },
        { "question": "Who is hurt?", "options": ["The boda boda rider", "Emma", "A child"], "answer": 0 },
        {
          "line": { "speaker": "emma", "target": "Anatoka damu! Nipigie gari la wagonjwa?", "base": "He’s bleeding! Shall I call an ambulance?" }
        },
        {
          "line": { "speaker": "juma", "target": "Ndiyo, piga simu haraka. Mimi nitakaa naye.", "base": "Yes, call quickly. I’ll stay with him." },
          "gloss": { "naye": "with him" }
        },
        { "question": "What does Emma do?", "options": ["Calls an ambulance", "Calls the police", "Runs home"], "answer": 0 },
        {
          "line": {
            "speaker": "juma",
            "target": "Rafiki, tulia. Usiogope, msaada unakuja.",
            "base": "Friend, calm down. Don’t be afraid, help is coming."
          }
        },
        {
          "question": "How does Juma say “don’t be afraid”?",
          "options": ["Usiogope", "Tulia", "Salama"],
          "answer": 0,
          "optionsLang": "target"
        }
      ]
    }
  ]
}
